{
  "schemaVersion": 1,
  "document": "HISTORICAL_RECONCILIATION_RECORD",
  "reconciliationId": "HISTORICAL_RECONCILIATION_GATE10_R1",
  "gateId": "GATE10",
  "recordedAt": "2026-08-10T12:00:00.000Z",
  "supersededGenesisEventId": "GENESIS_IMPORT_GATE10",
  "supersededGenesisEventPayloadSha256": "69ae9901f379b2854e4802a970815174a8e1da0bc186b47128f4f3c24382c62b",
  "originalImportedStatus": "NOT_STARTED",
  "originalStatusBasis": "UNRESOLVED_STATUS_FALLBACK",
  "originalStatusBasisSourcePath": "governance/authority/GENESIS_IMPORT_SOURCE_MAP.json",
  "originalStatusBasisSourceSha256": "a41bf05fcc4186c83f4e7928562250a260311cc92ccbbe31c37843af6dbeb92b",
  "historicalDisposition": "COMPLETE",
  "canonicalCurrentStatus": "COMPLETE_AGENT",
  "newExecutionOccurred": false,
  "externalConfirmationEstablished": false,
  "ownerAuthorizationPath": "governance/sources/HISTORICAL_RECONCILIATION_OWNER_AUTHORIZATION_R1.json",
  "ownerAuthorizationSha256": "78c703c4f46fd008320edb75281416aec4c209e8fad795cbfbf780bc61a7119b",
  "authorityCohort": [
    {
      "gateId": "GATE10",
      "evidenceRole": "STATUS_DISPOSITION_AUTHORITY",
      "historicalLocator": "C:\\Users\\melan\\AppData\\Local\\Temp\\l4c_i2_unified_authority_repair\\pre_gate09_proof_repair_20260727T161400Z\\gate10\\measurements\\gate10_gate_decision.json",
      "governedPath": "governance/authority/historical/GATE10/gate10_gate_decision.json",
      "byteLength": 493,
      "sha256": "de02e657426d49f3fdce7e53df48cc2895498c073a7fda50a63258515a2a6a27"
    }
  ],
  "evidenceCohortDigest": "34594a6869b01af87c9fe468b8cca96917cddd7b7915733cba0820bcd2fabbdd",
  "reason": "The GENESIS_IMPORT event recorded NOT_STARTED only as an UNRESOLVED_STATUS_FALLBACK. Authentic historical authority was recovered from the approved byte-authentic cohort. This reconciliation records recovered history only; no new gate execution or external confirmation occurred."
}
